{
  "ticketId": "EMBEROS-STAGING-MAIN-HYBRID-MIGRATION-WAVE-3-CREATE-CAMPAIGN-WIZARD-01",
  "wave": 3,
  "changeKind": "HYBRID_MIGRATION",
  "reason": "Migrate the Blueprint-approved five-step Create Campaign wizard while preserving main Campaign identity, commercial authorization, tenant isolation, asset ownership, and canonical generation handoff.",
  "sourceAuthority": "BLUEPRINT",
  "targetModule": "Create Campaign",
  "allowedSourcePaths": [
    "EMBEROS-BLUEPRINT-V1.3-UI-AUTHORITY-2026-08-25",
    "origin/staging@0add4c65aed02433aeeb96dfb943e4e3fbc075c8:apps/web/src/app/w/[slug]/campaigns/new/page.tsx",
    "origin/staging@0add4c65aed02433aeeb96dfb943e4e3fbc075c8:apps/web/src/components/campaign/**",
    "origin/staging@0add4c65aed02433aeeb96dfb943e4e3fbc075c8:apps/web/src/app/api/workspaces/[id]/audience/suggest/route.ts",
    "origin/staging@0add4c65aed02433aeeb96dfb943e4e3fbc075c8:apps/web/src/app/api/campaigns/[id]/brief/assist/route.ts",
    "origin/staging@0add4c65aed02433aeeb96dfb943e4e3fbc075c8:packages/shared/src/campaign-ai-context.ts",
    "origin/staging@0add4c65aed02433aeeb96dfb943e4e3fbc075c8:packages/shared/src/campaign-brief-assist.ts"
  ],
  "allowedTargetPaths": [
    ".migration-intents/**",
    ".github/workflows/ci.yml",
    "apps/web/src/app/w/**/campaigns/new/**",
    "apps/web/src/app/api/campaigns/create/**",
    "apps/web/src/app/api/workspaces/**/audience/suggest/**",
    "apps/web/src/app/api/workspaces/**/campaign-brief/assist/**",
    "apps/web/src/components/campaign/CreateCampaign*",
    "apps/web/src/lib/create-campaign*.ts",
    "packages/shared/src/create-campaign.ts",
    "packages/shared/src/campaign-brief-assist.ts",
    "packages/shared/src/index.ts",
    "packages/shared/src/i18n/**",
    "packages/db/src/schema/index.ts",
    "packages/db/src/queries/create-campaign.ts",
    "packages/db/src/index.ts",
    "packages/db/package.json",
    "packages/db/sql/create-campaign-wave3-v1.sql",
    "packages/db/scripts/apply-create-campaign-wave3-v1.ts",
    "tests/create-campaign-wave3*.test.ts",
    "e2e/create-campaign-wave3.spec.ts",
    "docs/architecture/**",
    "config/hybrid-migration-guards.json"
  ],
  "protectedDomainsExpectedToChange": [],
  "protectedDomainsMustNotChange": [
    "AI_STORY_RUNTIME",
    "AI_STORY_REVIEW",
    "AI_STORY_STAGED_RELEASE",
    "AI_STORY_RETRY_RECOVERY",
    "AI_STORY_PRODUCT_GROUNDING",
    "VIDEO_STUDIO_V1",
    "PHOTO_SCENE_V1",
    "PRIVATE_MEDIA_DELIVERY",
    "PROVIDER_ATTEMPT_AND_COST_ACCOUNTING",
    "COMMERCIAL_AUTH",
    "TENANT_WORKSPACE_ISOLATION"
  ],
  "requiredTests": [
    "tests/create-campaign-wave3.test.ts",
    "tests/create-campaign-wave3-api.test.ts",
    "tests/create-campaign-wave3.integration.test.ts",
    "e2e/create-campaign-wave3.spec.ts",
    "tests/asset-library-wave1.test.ts",
    "tests/business-profile-wave2.test.ts",
    "tests/tenant-access.test.ts",
    "tests/workspace-isolation.test.ts"
  ],
  "blueprintBaselineId": "EMBEROS-BLUEPRINT-V1.3-UI-AUTHORITY-2026-08-25"
}
